{
  "$schema": "./schemas/who-said-it.schema.json",
  "game": "who-said-it",
  "version": 1,
  "displayName": "Who Said It?",
  "roundsPerSession": 10,
  "sessions": [
    {
      "id": "wsi-session-001",
      "title": "Who Said It Pack 001",
      "theme": "Bible speakers",
      "rounds": [
        {
          "id": "wsi-r001",
          "quote": "Am I my brother's keeper?",
          "speaker": "Cain",
          "speakerAliases": [
            "Cain"
          ],
          "reference": "Genesis 4:9",
          "context": "Cain answered the LORD after Abel's death.",
          "sourceTranslation": "KJV",
          "theme": "Genesis",
          "difficulty": "easy",
          "teachingNote": "Genesis 4:9 identifies Cain as the speaker of \"Am I my brother's keeper?\" Cain answered the LORD after Abel's death. That context is why Cain is the correct answer."
        },
        {
          "id": "wsi-r002",
          "quote": "My son, God will provide himself a lamb for a burnt offering.",
          "speaker": "Abraham",
          "speakerAliases": [
            "Abraham",
            "Abram"
          ],
          "reference": "Genesis 22:8",
          "context": "Abraham answered Isaac on the way to Moriah.",
          "sourceTranslation": "KJV",
          "theme": "Faith",
          "difficulty": "medium",
          "teachingNote": "Genesis 22:8 identifies Abraham as the speaker of \"My son, God will provide himself a lamb for a burnt offering.\" Abraham answered Isaac on the way to Moriah. That context is why Abraham is the correct answer."
        },
        {
          "id": "wsi-r003",
          "quote": "Who is the LORD, that I should obey his voice to let Israel go?",
          "speaker": "Pharaoh",
          "speakerAliases": [
            "Pharaoh",
            "King of Egypt"
          ],
          "reference": "Exodus 5:2",
          "context": "Pharaoh answered Moses and Aaron in Egypt.",
          "sourceTranslation": "KJV",
          "theme": "Exodus",
          "difficulty": "hard",
          "teachingNote": "Exodus 5:2 identifies Pharaoh as the speaker of \"Who is the LORD, that I should obey his voice to let Israel go?\" Pharaoh answered Moses and Aaron in Egypt. That context is why Pharaoh is the correct answer."
        },
        {
          "id": "wsi-r004",
          "quote": "Intreat me not to leave thee, or to return from following after thee.",
          "speaker": "Ruth",
          "speakerAliases": [
            "Ruth"
          ],
          "reference": "Ruth 1:16",
          "context": "Ruth spoke to Naomi on the road from Moab.",
          "sourceTranslation": "KJV",
          "theme": "Loyalty",
          "difficulty": "easy",
          "teachingNote": "Ruth 1:16 identifies Ruth as the speaker of \"Intreat me not to leave thee, or to return from following after thee.\" Ruth spoke to Naomi on the road from Moab. That context is why Ruth is the correct answer."
        },
        {
          "id": "wsi-r005",
          "quote": "Thou comest to me with a sword, and with a spear, and with a shield.",
          "speaker": "David",
          "speakerAliases": [
            "David",
            "King David"
          ],
          "reference": "1 Samuel 17:45",
          "context": "David spoke to Goliath before the battle.",
          "sourceTranslation": "KJV",
          "theme": "Courage",
          "difficulty": "medium",
          "teachingNote": "1 Samuel 17:45 identifies David as the speaker of \"Thou comest to me with a sword, and with a spear, and with a shield.\" David spoke to Goliath before the battle. That context is why David is the correct answer."
        },
        {
          "id": "wsi-r006",
          "quote": "The LORD gave, and the LORD hath taken away; blessed be the name of the LORD.",
          "speaker": "Job",
          "speakerAliases": [
            "Job"
          ],
          "reference": "Job 1:21",
          "context": "Job worshipped after losing his children and possessions.",
          "sourceTranslation": "KJV",
          "theme": "Endurance",
          "difficulty": "hard",
          "teachingNote": "Job 1:21 identifies Job as the speaker of \"The LORD gave, and the LORD hath taken away; blessed be the name of the LORD.\" Job worshipped after losing his children and possessions. That context is why Job is the correct answer."
        },
        {
          "id": "wsi-r007",
          "quote": "Here am I; send me.",
          "speaker": "Isaiah",
          "speakerAliases": [
            "Isaiah",
            "Isaiah the prophet"
          ],
          "reference": "Isaiah 6:8",
          "context": "Isaiah answered the Lord's call.",
          "sourceTranslation": "KJV",
          "theme": "Calling",
          "difficulty": "easy",
          "teachingNote": "Isaiah 6:8 identifies Isaiah as the speaker of \"Here am I; send me.\" Isaiah answered the Lord's call. That context is why Isaiah is the correct answer."
        },
        {
          "id": "wsi-r008",
          "quote": "Salvation is of the LORD.",
          "speaker": "Jonah",
          "speakerAliases": [
            "Jonah",
            "Jonah the prophet"
          ],
          "reference": "Jonah 2:9",
          "context": "Jonah prayed from inside the fish.",
          "sourceTranslation": "KJV",
          "theme": "Prophets",
          "difficulty": "medium",
          "teachingNote": "Jonah 2:9 identifies Jonah as the speaker of \"Salvation is of the LORD.\" Jonah prayed from inside the fish. That context is why Jonah is the correct answer."
        },
        {
          "id": "wsi-r009",
          "quote": "This is my beloved Son, in whom I am well pleased.",
          "speaker": "God the Father",
          "speakerAliases": [
            "God the Father",
            "God",
            "The Father"
          ],
          "reference": "Matthew 3:17",
          "context": "The voice from heaven spoke at Jesus' baptism.",
          "sourceTranslation": "KJV",
          "theme": "Jesus",
          "difficulty": "hard",
          "teachingNote": "Matthew 3:17 identifies God the Father as the speaker of \"This is my beloved Son, in whom I am well pleased.\" The voice from heaven spoke at Jesus' baptism. That context is why God the Father is the correct answer."
        },
        {
          "id": "wsi-r010",
          "quote": "Man shall not live by bread alone, but by every word that proceedeth out of the mouth of God.",
          "speaker": "Jesus",
          "speakerAliases": [
            "Jesus",
            "Jesus Christ",
            "Christ"
          ],
          "reference": "Matthew 4:4",
          "context": "Jesus answered the tempter in the wilderness.",
          "sourceTranslation": "KJV",
          "theme": "Temptation",
          "difficulty": "easy",
          "teachingNote": "Matthew 4:4 identifies Jesus as the speaker of \"Man shall not live by bread alone, but by every word that proceedeth out of the mouth of God.\" Jesus answered the tempter in the wilderness. That context is why Jesus is the correct answer."
        }
      ]
    },
    {
      "id": "wsi-session-002",
      "title": "Who Said It Pack 002",
      "theme": "Bible speakers",
      "rounds": [
        {
          "id": "wsi-r011",
          "quote": "Thou art the Christ, the Son of the living God.",
          "speaker": "Peter",
          "speakerAliases": [
            "Peter",
            "Simon Peter",
            "Simon Barjona"
          ],
          "reference": "Matthew 16:16",
          "context": "Peter answered Jesus at Caesarea Philippi.",
          "sourceTranslation": "KJV",
          "theme": "Confession",
          "difficulty": "medium",
          "teachingNote": "Matthew 16:16 identifies Peter as the speaker of \"Thou art the Christ, the Son of the living God.\" Peter answered Jesus at Caesarea Philippi. That context is why Peter is the correct answer."
        },
        {
          "id": "wsi-r012",
          "quote": "Behold the handmaid of the Lord; be it unto me according to thy word.",
          "speaker": "Mary",
          "speakerAliases": [
            "Mary",
            "Mary the mother of Jesus"
          ],
          "reference": "Luke 1:38",
          "context": "Mary answered Gabriel.",
          "sourceTranslation": "KJV",
          "theme": "Birth of Jesus",
          "difficulty": "hard",
          "teachingNote": "Luke 1:38 identifies Mary as the speaker of \"Behold the handmaid of the Lord; be it unto me according to thy word.\" Mary answered Gabriel. That context is why Mary is the correct answer."
        },
        {
          "id": "wsi-r013",
          "quote": "My soul doth magnify the Lord,",
          "speaker": "Mary",
          "speakerAliases": [
            "Mary",
            "Mary the mother of Jesus"
          ],
          "reference": "Luke 1:46",
          "context": "Mary spoke while visiting Elisabeth.",
          "sourceTranslation": "KJV",
          "theme": "Praise",
          "difficulty": "easy",
          "teachingNote": "Luke 1:46 identifies Mary as the speaker of \"My soul doth magnify the Lord,\" Mary spoke while visiting Elisabeth. That context is why Mary is the correct answer."
        },
        {
          "id": "wsi-r014",
          "quote": "Lord, now lettest thou thy servant depart in peace, according to thy word:",
          "speaker": "Simeon",
          "speakerAliases": [
            "Simeon"
          ],
          "reference": "Luke 2:29",
          "context": "Simeon blessed God while holding the infant Jesus.",
          "sourceTranslation": "KJV",
          "theme": "Promise",
          "difficulty": "medium",
          "teachingNote": "Luke 2:29 identifies Simeon as the speaker of \"Lord, now lettest thou thy servant depart in peace, according to thy word:\" Simeon blessed God while holding the infant Jesus. That context is why Simeon is the correct answer."
        },
        {
          "id": "wsi-r015",